Job Title,Company Name,Location,Full-time / Part-time,Sector or Industry,Number of Applicants,Job Description
Recruitment Specialist,Careerist,"Shebin El Kom, Al Minufiyah, Egypt",Full-time,null,41 applicants,"About the job
About The Job

You’re looking for fulfillment, we’re looking for You!

Recruitment Specialist"
Flexible Work-From-Home Opportunities,Appen,Egypt,Part-time,null,Over 200 applicants,"About the job
We are looking for people from all over the world to participate in some of our many exciting work-from-home opportunities. These opportunities range from simple surveys that can be completed in less than one hour to on-going projects that last for months or longer. Leverage your social media interest, mobile device savviness, your college degree in linguistics, online research skills, or passion for images, video, or audio. With so many diverse projects, chances are we’ve got something for you."
Flexible Hours | Work from Home Opportunities for Egyptian Arabic Speakers in Egypt,Appen,"El Faiyum, Al Fayyum, Egypt",Part-time · Associate,null,Over 200 applicants,"About the job
About Appen
Appen collects and labels images, text, speech, audio, video, and other data used to build and continuously improve the world’s most innovative artificial intelligence systems. Our expertise includes having a global crowd of over 1 million skilled contractors who speak over 235 languages, in over 70,000 locations and 170 countries, and the industry’s most advanced AI-assisted data annotation platform. Our reliable training data gives leaders in technology, automotive, financial services, retail, healthcare, and governments the confidence to deploy world-class AI products. Founded in 1996, Appen has customers and offices globally."
Flexible Hours | Work from Home Opportunities for Standard Arabic Speakers in Egypt,Appen,"El Faiyum, Al Fayyum, Egypt",Part-time · Associate,null,Over 200 applicants,"About the job
About Appen
Appen collects and labels images, text, speech, audio, video, and other data used to build and continuously improve the world’s most innovative artificial intelligence systems. Our expertise includes having a global crowd of over 1 million skilled contractors who speak over 235 languages, in over 70,000 locations and 170 countries, and the industry’s most advanced AI-assisted data annotation platform. Our reliable training data gives leaders in technology, automotive, financial services, retail, healthcare, and governments the confidence to deploy world-class AI products. Founded in 1996, Appen has customers and offices globally."
Travel Advisor,Teleperformance,"New Cairo, Cairo, Egypt",Full-time,null,4 applicants,"About the job
Are you looking for a place where you can make a HUGE amount of money within a short period of time? Our basic salary is 6000 + 3000 EGP Quarter bonus.
Join Teleperformance and get 9K & have the chance to get promoted to a senior title and also get the below benefits:"
Travel Advisor,Teleperformance,"New Cairo, Cairo, Egypt",Full-time,null,10 applicants,"About the job
Are you looking for a place where you can make a HUGE amount of money within a short period of time? Our basic salary is 6000 + 3000 EGP Quarter bonus.
Join Teleperformance and get 9K & have the chance to get promoted to a senior title and also get the below benefits:"
Video Data Collection for Arabic speakers in Egypt,Appen,"Az Zaqāzīq, Sharkia, Egypt",Part-time · Associate,null,32 applicants,"About the job
Participate in a project that aims to make Artificial Intelligence work for everyone. Representation from all complexion types is required for this project so a qualifying skin tone question is asked to ensure that all groups are captured.
This study will require you to receive a package to your home address which contains a kit of toy letters and shapes and shoot 250 short videos of 10-45 seconds each that show case everyday objects you find in your home. Your videos will be scripted so if you can follow instructions and have a phone you are perfect for this project."
Data Collection Project for Standard Arabic Speakers in Egypt,Appen,"Az Zaqāzīq, Sharkia, Egypt",Part-time · Associate,null,32 applicants,"About the job
Are you ready to help drive advances in computer vision applications for a major technology company? If you have a smartphone and enjoy videos, then this project is perfect for you.
We are looking for several video submissions of different rooms in your home environment with the mains lighting switched ON and NOT from battery-powered or natural light. These will be taken on your smartphone devices and uploaded through our platform."
Data Collection Project for Standard Arabic (Saudi Arabia) Speakers in Egypt,Appen,"Az Zaqāzīq, Sharkia, Egypt",Part-time · Associate,null,41 applicants,"About the job
Are you ready to help drive advances in computer vision applications for a major technology company? If you have a smartphone and enjoy videos, then this project is perfect for you.
We are looking for several video submissions of different rooms in your home environment with the mains lighting switched ON and NOT from battery-powered or natural light. These will be taken on your smartphone devices and uploaded through our platform."
Senior Human Resources Manager,Maison Pyramide,"Cairo, Egypt",Full-time,null,Over 200 applicants,"About the job
The ideal candidate will support the full scope of Human Resources responsibilities and partner with the organization on strategic initiatives. They will maintain and enhance the organization's human resources by planning, implementing, and evaluating human resources policies, programs, and practices."
Recruiter,Novartis,"Cairo, Cairo, Egypt",Full-time,null,Over 200 applicants,"About the job
Job Description

766 million. That is an incredible number and represents the number of patients Novartis reached in 2021. That is a truly breathtaking number of moments that have mattered to the lives of our patients and represents the impact our organisation continues to make.

As a Senior Recruiter within Novartis you feed into that impact.

As a member of Global Talent Acquisition organization, you will be managing end to end recruitment and talent sourcing for positions based in Egypt.

You will act as Novartis brand ambassador to the external market by responsibly looking after candidates, vendors, and external associates while showcasing Novartis Values and Behaviors to the core.

Your responsibilities include, but are not limited to:













PHARMA



AMAC



Egypt



Cairo



NOV PHARMA EGY



Human Resources



Full Time



Regular



No



No"
Facial Expressions Video Collection for Arabic Speakers in Egypt,Appen,"Belbes, Sharkia, Egypt",Part-time · Associate,null,38 applicants,"About the job
Are you ready to have a bit of fun and make faces at the camera and say some random phrases? Then this project is for you! If you have a phone and enjoy having a bit of fun take a look and give this a go.
We are working with a leading technology provider to help improve facial expressions on smartphone devices and your actions could pave the way forward with new advances. How cool does that sound?"
Search Evaluator for Arabic Speakers in Egypt,Appen,"Az Zaqāzīq, Sharkia, Egypt",Part-time · Associate,null,72 applicants,"About the job
Would you like to annotate photos to help improve the product and services of the world's largest search engines? This is the project for you!
Requirements:
· Gmail and Google Photos services access"
Data Collection Project for English Speakers in Egypt,Appen,"Az Zaqāzīq, Sharkia, Egypt",Part-time · Associate,null,27 applicants,"About the job
Are you using social media? Are you interested in helping a project to improve relevance content to users? This project is for you!
Perks:
· Long term project commitment
· Flexible hours (15-20/ week)"
ECEMEA Senior Recruiter/Talent Advisor (220003QJ) ECEMEA Senior Recruiter/Talent Advisor,Oracle,"Cairo, Egypt",Full-time · Entry level,null,149 applicants,"About the job
RESPONSIBILITIES:
Working with the business to understand their requirements, be first point of contact for hiring managers within assigned Lines of Business
Partner with hiring managers to develop long-term business relationships and become a key member of their support team."
Data Collection Project for English Speakers in Egypt,Appen,"Alexandria, Egypt",Part-time · Associate,null,46 applicants,"About the job
For this project, using your Smartphone’s camera and our Appen Data Annotation Platform (ADAP), we would like you to take pictures and videos of specific common household objects. There are 108 specific objects that we are looking for.
For each object you select, you will be asked to take one picture and 10 videos, each being 10 seconds long, of that object, under specific recording conditions."
Data Collection Project for Standard Arabic (United Arab Emirates) Speakers in Egypt,Appen,"Az Zaqāzīq, Sharkia, Egypt",Part-time · Associate,null,44 applicants,"About the job
Are you ready to help drive advances in computer vision applications for a major technology company? If you have a smartphone and enjoy taking photos, then this project is perfect for you.
It will take no more than 30 minutes to complete the whole task.
Benefits:"
Search Evaluator for Egyptian Arabic Speakers in Egypt,Appen,"Banha, Al Qalyubiyah, Egypt",Part-time · Associate,null,135 applicants,"About the job
About Appen
Appen collects and labels images, text, speech, audio, video, and other data used to build and continuously improve the world’s most innovative artificial intelligence systems. Our expertise includes having a global crowd of over 1 million skilled contractors who speak over 235 languages, in over 70,000 locations and 170 countries, and the industry’s most advanced AI-assisted data annotation platform. Our reliable training data gives leaders in technology, automotive, financial services, retail, healthcare, and governments the confidence to deploy world-class AI products. Founded in 1996, Appen has customers and offices globally."
Academy Manager,Elsa Academy,"6th of October, Al Jizah, Egypt",Part-time,null,12 applicants,"About the job
The Successful Candidate Must Demonstrate
Master's degree in education administration / University degree in Language Arts, Education, or a related discipline
Minimum of five years’ experience in teaching or education leadership·
Proficiency in written and spoken English and Arabic
Strong leadership experience and effective leadership skills to include coaching and mentoring to support employees in achieving goals.
Effective and collaborative communication with staff and leadership, with effective written and oral communication techniques to convey clear and timely messages.
Ability to assess and respond to customer needs, making customer service a high priority and striving to anticipate, identify, understand, and be responsive to customer needs and expectations.
Critical, creative, and reflective thinking to analyze problems and evaluate ideas and information to develop action plans.
Strong organizational skills including prioritization and accuracy, adapting approaches, goals, and methods to achieve solutions and results in dynamic situations.
Excellent time management, problem-solving techniques and use of professional judgment in complex and sensitive situations.
Proficient computer skills, including Microsoft Office
Ability to multitask and re-prioritize assignments while maintaining attention to detail.
Commitment to the highest ethical standards and to act with professionalism and integrity.

Location: 6th October City

Working hours:
Saturday 12 p.m. to 6 p.m.
Sunday to Thursday from 3 p.m. to 8 p.m.

To apply: send your c.v. to elsaacademy@hotmail.com with the subject: Academy Manager"
Customer service French & German Speakers,null,Egypt,Full-time,null,5 applicants,"About the job
A Multinational company is hiring for customer service agent Fluent in French German with a very good English
Job Description
- Handling incoming inquiries from French / German customers via the phone, email, and online."
Data Collection Project for Standard Arabic (Saudi Arabia) Speakers in Egypt,Appen,"Az Zaqāzīq, Sharkia, Egypt",Part-time · Associate,null,38 applicants,"About the job
Are you ready to help drive advances in computer vision applications for a major technology company? If you have a smartphone and enjoy taking photos, then this project is perfect for you.
It will take no more than 30 minutes to complete the whole task.
Benefits:"
Explore new opportunities at Appen! Apply now!,Appen,"Alexandria, Alexandria, Egypt",Part-time · Entry level,null,Over 200 applicants,"About the job
About Appen
Appen collects and labels images, text, speech, audio, video, and other data used to build and continuously improve the world’s most innovative artificial intelligence systems. Our expertise includes having a global crowd of over 1 million skilled contractors who speak over 235 languages, in over 70,000 locations and 170 countries, and the industry’s most advanced AI-assisted data annotation platform. Our reliable training data gives leaders in technology, automotive, financial services, retail, healthcare, and governments the confidence to deploy world-class AI products. Founded in 1996, Appen has customers and offices globally."
Social Media Evaluator for Arabic Speakers in Egypt,Appen,"Banha, Al Qalyubiyah, Egypt",Part-time · Associate,null,Over 200 applicants,"About the job
About Appen
Appen collects and labels images, text, speech, audio, video, and other data used to build and continuously improve the world’s most innovative artificial intelligence systems. Our expertise includes having a global crowd of over 1 million skilled contractors who speak over 235 languages, in over 70,000 locations and 170 countries, and the industry’s most advanced AI-assisted data annotation platform. Our reliable training data gives leaders in technology, automotive, financial services, retail, healthcare, and governments the confidence to deploy world-class AI products. Founded in 1996, Appen has customers and offices globally."
360 Data Management Specialist,Mercedes-Benz Egypt,"New Cairo, Cairo, Egypt",Full-time · Entry level,null,Over 200 applicants,"About the job
Are you looking for a new challenge ?
Do you enjoy working in a multi-cultural environment?
Mercedes-Benz Egypt can offer you this opportunity within an innovative market in the role of 360 Data Management Specialist."
Social Media Evaluation for English Speakers in Egypt,Appen,"Alexandria, Egypt",Part-time · Associate,null,111 applicants,"About the job
Help a large Social Media platform evaluate the e-commerce shopping experience by purchasing items and completing surveys related to the experience.
Mystery Shoppers will be completing and reviewing the shopping experience of e-commerce advertisers on a well-known social media platform."
Data Analyst for Standard Arabic Speakers in Egypt,Appen,"Az Zaqāzīq, Sharkia, Egypt",Part-time · Associate,null,112 applicants,"About the job
About Appen
Appen collects and labels images, text, speech, audio, video, and other data used to build and continuously improve the world’s most innovative artificial intelligence systems. Our expertise includes having a global crowd of over 1 million skilled contractors who speak over 235 languages, in over 70,000 locations and 170 countries, and the industry’s most advanced AI-assisted data annotation platform. Our reliable training data gives leaders in technology, automotive, financial services, retail, healthcare, and governments the confidence to deploy world-class AI products. Founded in 1996, Appen has customers and offices globally."
Social Media Evaluation for English Speakers in Egypt,Appen,"Belbes, Sharkia, Egypt",Part-time · Associate,null,48 applicants,"About the job
Help a large Social Media platform evaluate the e-commerce shopping experience by purchasing items and completing surveys related to the experience.
Mystery Shoppers will be completing and reviewing the shopping experience of e-commerce advertisers on a well-known social media platform."
IT Audit- Senior Associate/Manager- Egypt,PwC Middle East,"Cairo, Cairo, Egypt",Full-time · Associate,null,26 applicants,"About the job
Line of Service

Industry/Sector

Specialism



Senior Associate



A career in our Information Technology Audit Services practice, within Risk and Compliance services, will provide you the opportunity to work with a team that provides clients with extensive risk and controls technical knowledge and sector specific experience. You’ll have the opportunity to develop a holistic approach to risk that protects businesses, facilitates strategic decision making and enhances efficiency by assisting management in the assessment of project risks and controls.

Our team uses current and emerging technologies to assist clients with financial reporting, compliance, and operational processes controls. You’ll provide services related to controls around the financial reporting, compliance and operational processes, including business process and Information Technology management controls.

To really stand out and make us fit for the future in a constantly changing world, each and every one of us at PwC needs to be a purpose-led and values-driven leader at every level. To help us achieve this we have the PwC Professional; our global leadership development framework. It gives us a single set of expectations across our lines, geographies and career paths, and provides transparency on the skills we need as individuals to be successful and progress in our careers, now and in the future.



PwC Professional skills and responsibilities for this management level include but are not limited to

As a Senior Associate, you'll work as part of a team of problem solvers, helping to solve complex business issues from strategy to execution.





Degrees/Field of Study preferred:











Not Specified



Yes



Yes"
Desktop Support Technician,Excis Compliance,"New Cairo, Cairo, Egypt",Full-time · Mid-Senior level,null,76 applicants,"About the job
Three to four (3-4) years experience providing IT Infrastructure field support in a corporate environment which includes troubleshooting hardware, software, operating system issues, and problems and fixing the issues without impacting/violating the hardware warranty or customer security compliance requirements.
One to two years experience working in a service desk environment with the ability to receive calls / troubleshoot and log user queries.
Hands-on experience in installing, troubleshooting, and fixing desktops, printers, laptops, and other computer peripherals hardware problems as well as desktop applications.
Experience in Dell/HP Desktops/Laptops
Basic knowledge of enterprise LAN and WAN setups and concepts. Ability to perform smart hand activity under instruction-based activities at sites.
Ability to lift/move the computer and network equipment.
Skilled in desk side support and PC break/fix including administration of Windows 10 O/S
Some usage Knowledge of TCP/IP networking, DNS, DHCP, VPN, and RDP.
Ability to troubleshoot issues with systems and networks using good deductive reasoning skills and troubleshooting & resolving issues related to end-user network cabling.
Ability to work alone and also work well with various remote global teams
Good written and oral communications skills with clients and management as well as people skills.
Ability to work with deadlines and complete tasks on time.
Flexibility with working hours and ability to travel between sites
Knowledge and experience of ticketing tools (ServiceNow / Remedy etc.),

Non-Technical
• Good Customer management skills,
• Good in oral and written communication
• Able to interact and work with the customer at different levels.
• Self- Driven and result-oriented.
• Really passionate about the work
• Arabian and English fluent language is required"
Video Data Collection for English speakers in Egypt,Appen,"El Faiyum, Al Fayyum, Egypt",Part-time · Associate,null,27 applicants,"About the job
Participate in a project that aims to make Artificial Intelligence work for everyone. Representation from all complexion types is required for this project so a qualifying skin tone question is asked to ensure that all groups are captured.
This study will require you to receive a package to your home address which contains a kit of toy letters and shapes and shoot 250 short videos of 10-45 seconds each that show case everyday objects you find in your home. Your videos will be scripted so if you can follow instructions and have a phone you are perfect for this project."
Internet Analyst Remote Opportunity | for English Speakers in Egypt,Appen,"Kafr El Sheikh, Kafr ash Shaykh, Egypt",Part-time · Associate,null,82 applicants,"About the job
About Appen
Appen collects and labels images, text, speech, audio, video, and other data used to build and continuously improve the world’s most innovative artificial intelligence systems. Our expertise includes having a global crowd of over 1 million skilled contractors who speak over 235 languages, in over 70,000 locations and 170 countries, and the industry’s most advanced AI-assisted data annotation platform. Our reliable training data gives leaders in technology, automotive, financial services, retail, healthcare, and governments the confidence to deploy world-class AI products. Founded in 1996, Appen has customers and offices globally."
Social Media Evaluation for English speakers in Egypt,Appen,"Alexandria, Egypt",Part-time · Associate,null,85 applicants,"About the job
Help a large Social Media platform evaluate the e-commerce shopping experience by purchasing items and completing surveys related to the experience. Join us now!
Requirements:
· Should have some disposable income to make purchases upfront."
Facial Expressions Video Collection for Arabic Speakers in Egypt,Appen,"El Faiyum, Al Fayyum, Egypt",Part-time · Associate,null,30 applicants,"About the job
Are you ready to have a bit of fun and make faces at the camera and say some random phrases? Then this project is for you! If you have a phone and enjoy having a bit of fun take a look and give this a go.
We are working with a leading technology provider to help improve facial expressions on smartphone devices and your actions could pave the way forward with new advances. How cool does that sound?"
Egypt Architect Java Developer,CI&T,Egypt,Full-time · Mid-Senior level,null,17 applicants,"About the job
CI&T is a digital specialist, partner in end-to-end digital transformation. As digital natives, we bring a 26-year track record of accelerating business impact through complete and scalable digital solutions. With a global presence of more than 5.000 professionals in strategy, research, data science, design and engineering, we unlock top-line growth, improve customer experience and drive operational efficiency.





Abstraction on Java (abstract classes, interfaces, default methods) and how to use it







This position may be fulfilled by a CI&T partner.

#Senior



We know that innovation and transformation only happen in diverse and safe work environments, where people from different backgrounds and experiences come together to share and create ideas. We are building teams that are increasingly diverse in terms of disabilities, age, gender identity and sexual orientation, ethnicity and race, religion, cultures and experiences. Therefore, our opportunities are for EVERYONE!

To promote inclusion, we believe it is important to break down physical and behavioral barriers. So, if you are a person with a disability, tell us from the beginning if you need any accessibility resource for the selection process."
