Job Title,Company Name,Location,Full-time / Part-time,Sector or Industry,Number of Applicants,Job Description
Catalogue Manager,IBM,"Cairo, Cairo, Egypt",Full-time,null,27 applicants,"About the job
533171BR

Introduction

At IBM, work is more than a job - it's a calling- To build, To design, To engage, To consult, To think along with clients and stay proactive and To collaborate. Not just to do something better, but to attempt things you've never thought possible. Are you ready to lead in this new era of technology and solve some of the world's most challenging problems with those amazing Catalogue / Contract Manager skills? If so, lets talk.

We are looking for a responsible Contract Administrator to join our team. Your main duties will be to prepare, negotiate and review contracts



* Develop, negotiate, and evaluate company contracts / catalogues on behalf of an organization *









NA



IBM Consulting is IBM’s consulting and global professional services business, with market leading capabilities in business and technology transformation. With deep expertise in many industries, we offer strategy, experience, technology, and operations services to many of the most innovative and valuable companies in the world. Our people are focused on accelerating our clients’ businesses through the power of collaboration. We believe in the power of technology responsibly used to help people, partners and the planet.



Are you craving to learn more? Prepared to solve some of the world's most unique challenges? And ready to shape the future for millions of people? If so, then it's time to join us, express your individuality, unleash your curiosity and discover new possibilities.

Every IBMer, and potential ones like yourself, has a voice, carves their own path, and uses their expertise to help co-create and add to our story. Together, we have the power to make meaningful change – to alter the fabric of our clients, of society and IBM itself, to create a truly positive impact and make the world work better for everyone.

It's time to define your career.



IBM’s greatest invention is the IBMer. We believe that through the application of intelligence, reason and science, we can improve business, society and the human condition, bringing the power of an open hybrid cloud and AI strategy to life for our clients and partners around the world.

Restlessly reinventing since 1911, we are not only one of the largest corporate organizations in the world, we’re also one of the biggest technology and consulting employers, with many of the Fortune 50 companies relying on the IBM Cloud to run their business.

At IBM, we pride ourselves on being an early adopter of artificial intelligence, quantum computing and blockchain. Now it’s time for you to join us on our journey to being a responsible technology innovator and a force for good in the world.



IBM wants you to bring your whole self to work and for you this might mean the ability to work flexibly. If you are interested in a flexible working pattern, please talk to our recruitment team to find out if this is possible in the current working environment.



IBM is committed to creating a diverse environment and is proud to be an equal opportunity employer. All qualified applicants will receive consideration for employment without regard to race, color, religion, gender, gender identity or expression, sexual orientation, national origin, genetics, pregnancy, disability, age, veteran status, or other characteristics. IBM is also committed to compliance with all fair employment practices regarding citizenship and immigration status."
Order Fulfilment Analyst,Nestlé,"Cairo, Cairo, Egypt",Full-time,null,76 applicants,"About the job
Position Snapshot

Location: Cairo, Egypt

Company: Nestlé Egypt

1 Year Contract



The Order Fulfillment Analyst is responsible for the effective management of the stock allocation process, including proactively reviewing demand & supply simulations and executing customer behavior analysis. As well as collaborate across market functions to align on actions to mitigate risk and impact, while enhancing the business' ability to provide proactive communication to customers in need for out-of-stock situations."
"ETIC, SAP Infrastructure / Basis / Security - Associate (Egypt)",PwC Middle East,"Cairo, Cairo, Egypt",Full-time · Associate,null,11 applicants,"About the job
Line of Service

Advisory

Industry/Sector

Technology



Advisory - Other



Associate





PwC is opening a new Technology & Innovation Center in Cairo that will deliver high quality technology solutions to consulting Clients across the globe. The Centre will provide a broad suite of skills and services to our clients, ranging from Packaged Applications such as SAP & Oracle, to Cloud services utilising AWS, Azure and Google, as well as expanding our existing Managed Services capabilities.

The center is looking to expand rapidly and we are looking for enthusiastic self-starters with a passion for technology and client delivery to help shape and form this new venture.

We are seeking to recruit a SAP Infrastructure / Basis / Security specialist to join our team in Cairo. The successful candidate will have a minimum of 2 years experience in delivering SAP (ECC and S/4HANA) integrated solutions

You will report to the SAP Leader and work alongside PwC Team Members in Cairo as well as those working on client projects across the PwC Global Network, including the UK, Germany and Middle East.













Degrees/Field of Study preferred:











Not Specified



Yes



No"
Video Data Collection for Arabic speakers in Egypt,Appen,"Giza, Al Jizah, Egypt",Part-time · Associate,null,53 applicants,"About the job
Participate in a project that aims to make Artificial Intelligence work for everyone. Representation from all complexion types is required for this project so a qualifying skin tone question is asked to ensure that all groups are captured.
This study will require you to receive a package to your home address which contains a kit of toy letters and shapes and shoot 250 short videos of 10-45 seconds each that show case everyday objects you find in your home. Your videos will be scripted so if you can follow instructions and have a phone you are perfect for this project."
Oracle HCM Section Manager.,DMG | Mountain View,"Cairo, Egypt",Full-time · Mid-Senior level,null,85 applicants,"About the job
Job Scope:
· Perform solution requirements gathering architecture, design, testing and implementing work.
· Perform and follow-up all related tasks that impact the applications implementations and support."
Project Opening in Egypt!,Appen,Egypt,Part-time · Entry level,null,Over 200 applicants,"About the job
We are seeking individuals in Egypt who are looking for an exciting work from home opportunity. Our mission is to deliver the best data solutions and expertise to developers of AI for communication, driven by our passion for innovation and our love of languages."
"ETIC, SAP Solution Architect - Senior Manager (Egypt)",PwC Middle East,"Cairo, Cairo, Egypt",Full-time · Mid-Senior level,null,11 applicants,"About the job
Line of Service

Advisory

Industry/Sector

Technology



Advisory - Other



Senior Manager





PwC is opening a new Technology & Innovation Center in Cairo that will deliver high quality technology solutions to consulting Clients across the globe. The Centre will provide a broad suite of skills and services to our clients, ranging from Packaged Applications such as SAP & Oracle, to Cloud services utilising AWS, Azure and Google, as well as expanding our existing Managed Services capabilities.

The center is looking to expand rapidly and we are looking for enthusiastic self-starters with a passion for technology and client delivery to help shape and form this new venture.

We are seeking to recruit a SAP Solution Architect to join our team in Cairo. The successful candidate will have a minimum of 8 years experience in scoping, designing and overseeing the delivery of complex SAP (ECC and S/4HANA) centred, high value solutions. They will be a recognised expert in their field within the local SAP market; providing valued thought leadership and opinion. They will carry a well established professional network, and have strong alliances into the SAP ecosystem.

You will report to the SAP Service Delivery Director and will be an integral part of the team based in Cairo, as well as those delivering client transformation programmes across the PwC Global Network, including the UK, Germany and Middle East

As an SAP Solution Architect, you will play a key role in the following areas:







Degrees/Field of Study preferred:











Not Specified



Yes



No"
H&D Offer Manager,Schneider Electric,"Cairo, Cairo, Egypt",Full-time · Associate,null,34 applicants,"About the job
Who are we and what we stand for?

When you work for Schneider Electric you work for a company that is passionate about its people. Our people vision says, Great people make Schneider Electric a great company. We are proud to promote purpose, diversity, inclusion, learning and work-life integration – we’re a great place to work and we are continually striving to be the best place to work!









Full-time

007RCV"
Talent Acquisition Partner (6 Months Contract),IBM,"Cairo, Cairo, Egypt",Full-time,null,1 applicant,"About the job
532614BR

Introduction

At IBM, work is more than a job - it's a calling: To build. To design. To code. To consult. To think along with clients and sell. To make markets. To invent. To collaborate. Not just to do something better, but to attempt things you've never thought possible. Are you ready to lead in this new era of technology and solve some of the world's most challenging problems? If so, lets talk.



The Talent Acquisition Partner (TAP) is responsible for the development of recruiting plans, employing traditional sourcing strategies as well as developing new innovative recruitment approaches to support IBM Consulting. We are looking for a TAP that can excel in a fast-paced corporate environment with demonstrated experience in sourcing, screening, qualifying, interviewing and candidate relationship management. In lieu of this experience, a high performing Talent Acquisition support professional with a desire to usher in IBMers of tomorrow, and a passion to serve the client, is welcomed. This role is responsible for providing strategic recruitment support for the IBM Services area. The role will be supporting on our priority growth areas like AI, SAP, Microservices, and Blockchain to name a few. The TAP will execute external recruiting, act as the key contact for Early Professional candidates, drive recruiting strategies, and build/maintain client relationships. You will interface with business leaders to deliver qualified talent to fill critical roles and provide market intelligence to drive recruiting business outcomes. Overall, this position plays a critical role in ensuring that the best possible talent will be hired through a partnership with the Business Leaders and Talent Acquisition.











Experience supporting the Technology Service Centers, in IBM similar organizations preferred

Exposure to university and graduate programs preferred.



IBM Corporate Headquarters (CHQ) team represents a variety of functions such as marketing, finance, legal, operations, HR, and more, all working together to solve some of the world's most complex problems, help our clients achieve success and build collaborative work environments for IBMers.



Are you craving to learn more? Prepared to solve some of the world's most unique challenges? And ready to shape the future for millions of people? If so, then it's time to join us, express your individuality, unleash your curiosity and discover new possibilities.

Every IBMer, and potential ones like yourself, has a voice, carves their own path, and uses their expertise to help co-create and add to our story. Together, we have the power to make meaningful change – to alter the fabric of our clients, of society and IBM itself, to create a truly positive impact and make the world work better for everyone.

It's time to define your career.



IBM’s greatest invention is the IBMer. We believe that through the application of intelligence, reason and science, we can improve business, society and the human condition, bringing the power of an open hybrid cloud and AI strategy to life for our clients and partners around the world.

Restlessly reinventing since 1911, we are not only one of the largest corporate organizations in the world, we’re also one of the biggest technology and consulting employers, with many of the Fortune 50 companies relying on the IBM Cloud to run their business.

At IBM, we pride ourselves on being an early adopter of artificial intelligence, quantum computing and blockchain. Now it’s time for you to join us on our journey to being a responsible technology innovator and a force for good in the world.



For additional information about location requirements, please discuss with the recruiter following submission of your application.



IBM is committed to creating a diverse environment and is proud to be an equal opportunity employer. All qualified applicants will receive consideration for employment without regard to race, color, religion, gender, gender identity or expression, sexual orientation, national origin, genetics, pregnancy, disability, age, veteran status, or other characteristics. IBM is also committed to compliance with all fair employment practices regarding citizenship and immigration status."
Account Advisor II - Content,talabat,"Qesm El Maadi, Cairo, Egypt",Full-time · Associate,null,Over 200 applicants,"About the job
When you think of food delivery in the MENA region, we’d be pretty surprised if talabat didn’t pop into your mind first! Since delivering our first order in Kuwait in 2004, we’ve grown quite a lot over the past 17 years.

Today, we deliver hundreds of millions of food orders, grocery items and other products per year, to our customers in nine countries throughout the region with more than 3,000+ employees! Our food delivery business works with over 27,000 brands and almost 50,000 branches, while our q-commerce concept, talabat mart, now delivers groceries to customers in Bahrain, Egypt, Jordan, Kuwait, Oman Qatar, and the UAE in 30 minutes or less!

Our philosophy is to make sure we do what is right for our ecosystem - our customers, our partners, our people, our riders, and the communities in which we operate. Our #techforgood program allows our customers a safe and convenient way to contribute to important causes in their community through donating to local and international charities directly on talabat with a focus on food insecurity in the region. Since its inception in 2020, we have facilitated the donation of well over 1 million meals to those in need, as well as donated over $1.5 million to charity with the help of our partners and customers. talabat is part of Delivery Hero, the global leader in online food delivery and q-commerce.



Account Advisor II - Content is responsible for updating and making sure that the information related to all the existing vendors is up to date, in addition to adding the new vendor's data is accurate on the application."
Staff Consultant WWCC GMC,VMware,"Cairo, Cairo, Egypt",Full-time,null,8 applicants,"About the job
The Elevator Pitch: Why will you enjoy this new opportunity?

The most advanced companies in the world turn to VMware to manage, grow, and transform their business. When you work here, you’re connected to a global community of innovative, empowered employees working together to solve the most critical technology challenges. The World Wide Consulting Centers (WWCC) organization aims at providing a centralized world class professional services delivery through the a global BU with co-located sites that drives adoption and improved margin at scale.

Part of the WWCC is the Global Migration Center (GMC) whose main focus is accelerating customer journeys by providing technology-driven services using specialized tool chains and skilled resources committed to rapidly delivering successful application workload rehosting engagements such as P2V, V2V, V2C as well as VMC on AWS and Azure.

As a Staff Consultant, you have the opportunity to join our growing project delivery practice, focusing on GMC activities. Become a member of our collaborative and supportive work environment and help us drive innovation!





The ideal candidate will need to be able to understand the customers vision and to

be able to translate this to desired business outcomes and the IT solutions which underpin them









The hiring manager for this role is Mohamed Mortada, Senior Manager, WWCC. His expertise has been shaped by 12 years in the IT industry in Delivery roles both technical and project management based then for the last 7 years straight in regional delivery management across Europe.

Mohamed’s management style is based on enablement and empowerment. As part of his team, you will be sharing both the success of the group as well as the responsibilities thus maximizing your contribution to the progress of the BU and allowing you to grow and sharpen your skills profile.

The team is made of project managers and technical consultants, all operating on the frontline with our customer, sales teams and technical staff within VMware in Europe, the Middle East and Americas. The team works flexible hours without alignment to a certain region or Geo and every individual is expecting to rotate between the mentioned Geos iteratively.



This role is based out of VMware’s Cairo (Egypt) office and is open to candidates in the surrounding Egypt.



You and your loved ones will be supported with a competitive and comprehensive benefits package. Below are some highlights, or you can view the complete benefits package by visiting www.benefits.vmware.com.



Services and Consulting

Consultant

Business Leadership

Full Time

2022-03-08

VMware Company Overview: At VMware, we believe that software has the power to unlock new opportunities for people and our planet. We look beyond the barriers of compromise to engineer new ways to make technologies work together seamlessly. Our cloud, mobility, and security software form a flexible, consistent digital foundation for securely delivering the apps, services and experiences that are transforming business innovation around the globe. At the core of what we do are our people who deeply value execution, passion, integrity, customers, and community. Shape what’s possible today at http://careers.vmware.com.

Equal Employment Opportunity Statement: VMware is an Equal Opportunity Employer and Prohibits Discrimination and Harassment of Any Kind: VMware is committed to the principle of equal employment opportunity for all employees and to providing employees with a work environment free of discrimination and harassment. All employment decisions at VMware are based on business needs, job requirements and individual qualifications, without regard to race, color, religion or belief, national, social or ethnic origin, sex (including pregnancy), age, physical, mental or sensory disability, HIV Status, sexual orientation, gender identity and/or expression, marital, civil union or domestic partnership status, past or present military service, family medical history or genetic information, family or parental status, or any other status protected by the laws or regulations in the locations where we operate. VMware will not tolerate discrimination or harassment based on any of these characteristics. VMware encourages applicants of all ages. Vmware will provide reasonable accommodation to employees who have protected disabilities consistent with local law."
Beauty Consultant Faces- Egypt,Chalhoub Group,"Cairo, Cairo, Egypt",Full-time · Associate,null,26 applicants,"About the job
Who We Are

We are a leading partner for luxury across the Middle East. With more than 600 stores, 300 brands and over 65 years of experience in the region, we have become a major player in the beauty, fashion and gift sectors, by offering service excellence to our partners and delighting all our customers. We are moving fast from a traditional distributor and retailer for luxury in the Middle East, to a hybrid retailer bringing luxury experiences to the fingertips of customers everywhere.

To fuel the next stage of our growth we are looking to build a world class team. From physical retail through to supply chain and customer loyalty, we aim to use technology and data to continuously improve every aspect of our operations. We are looking for top talent to join us on this journey of exploring new horizons together.



Our Beauty Consultant is responsible for delivering outstanding customer service to all customers and to use appropriate sales techniques and product knowledge to reach sales targets. Our Beauty Consultant is accountable for counter cleanliness, stock replenishment, handling new launches, promotion of products and merchandising. Our Consultant is also required to maintain high levels of standards in terms of grooming.





With us, you will turn your aspirations into reality. We will help shape your journey through enriching experiences, learning and development opportunities and exposure to different assignments within your role or through internal mobility. Our Group offers diverse career paths for those who are extraordinary, every day.

We recognise the value that you bring, and we strive to provide a competitive benefits package which includes health care, child education contribution, remote and flexible working policies as well as exclusive employee discounts. To view all our perks and benefits, click here."
Cloud Solution Architecture Manager,Microsoft,"Cairo, Cairo, Egypt",Full-time,null,61 applicants,"About the job
Microsoft is on a mission to empower every person and every organization on the planet to achieve more. Our culture is centered on embracing a growth mindset, a theme of inspiring excellence, and encouraging teams and leaders to bring their best each day. In doing so, we create life-changing innovations that impact billions of lives around the world. You can help us to achieve our mission.

Microsoft aspires to help our customers achieve their own digital transformation, leveraging the power of Microsoft Cloud and Edge solutions and support offerings. To this end, Microsoft invests in a dedicated Customer Success team that will help Microsoft customers successfully realize their business outcomes.

To learn more about Microsoft’s mission, please visit: https://careers.microsoft.com/mission-culture

Check out all our products at: http://www.microsoft.com/en-us



People Management

Understanding Customer/Partner Technical Environment

Architecture Design and Deployment

Practice Development

Trusted Advisor

Thought Leadership

Customer Usage





Required/Minimum Qualifications



Microsoft is an equal opportunity employer. All qualified applicants will receive consideration for employment without regard to age, ancestry, color, family or medical care leave, gender identity or expression, genetic information, marital status, medical condition, national origin, physical or mental disability, political affiliation, protected veteran status, race, religion, sex (including pregnancy), sexual orientation, or any other characteristic protected by applicable laws, regulations and ordinances.

Benefits/perks listed below may vary depending on the nature of your employment with Microsoft and the country where you work."
Gender & SBC Senior Technical Advisor - Egypt,FHI 360,"Cairo, Egypt",Full-time · Mid-Senior level,null,15 applicants,"About the job
FHI 360 is seeking applications for a Gender & SBC Senior Technical Advisor for an anticipated USAID project in Egypt focused on family planning. The Gender & SBC Senior Technical Advisor will assist the Chief of Party in ensuring the overall success of the project and will be responsible for managing the technical direction and integration of gender-transformative and gender-sensitive components throughout the project operations and implementation. Provides technical assistance, direction and support related to the development and implementation of SBC strategies across a range of health and development areas in all phases from formative research through design, media and material production, community mobilization and engagement, and evaluation. The position will be based in Egypt and will report to the COP. Responds to the specified deliverables and goals of contracts and grant agreements, ensuring achievements in a timely manner and in full support and compliance with FHI 360 contractual agreements."
Customer Service officer,Majid Al Futtaim,Egypt,null,null,172 applicants,"About the job
Role Purpose

The position is mainly responsible for the day to day smooth operations of the Customer Service Information Desk / booth ensuring that all customer service related activities is carried out in accordance with the prescribed policies and guidelines and the services provided are of the highest level standards to ensure a pleasant customer experience."
