Job Title,Company Name,Location,Full-time / Part-time,Sector or Industry,Number of Applicants,Job Description
Communications Manager - Egypt,Philip Morris International,"Cairo, Cairo, Egypt",Full-time,null,Over 200 applicants,"About the job
Do you have a passion for brands and the history they represent? Are you an excellent communicator with exceptional analytical skills, self-organized and achievement oriented? Do you want to make a difference in our organization and contribute to building something new? If the answer is yes to all these questions, then we would like to hear from you.

We are looking for an experienced Communications Manager in Egypt. A Bachelor’s degree and a minimum of 10 years of professional experience in external communications and PR are required, together with excellent command of English and Arabic.

RISE TO THE CHALLENGE

You will be part of the External Affairs team of “Philip Morris Misr” and will report to the Head of Communications for the Egypt & Levant Cluster. As a Communications professional, you will design and lead corporate communication programs to raise awareness and increase understanding of PM goals across all media and communication platforms, develop and implement high profile communication initiatives and engagement strategies to support the delivery of PM’s strategic direction towards a smoke free future. You will contribute to and execute external communications in line with the market needs and company strategy to increase PMI’s visibility in Egypt.

More specifically you will

REGION Cairo, Egypt.

FIND A NEW PATH

Our organization offers you a fresh perspective. We take the concept of on-the-job learning to another level, giving you every opportunity to develop your career and reach your full potential. You will be exposed to innovative technologies, services, and processes, and you will benefit from competitive salary and an attractive compensation package.

JOIN A GLOBAL MARKET LEADER

Philip Morris Misr is an affiliate of Philip Morris International Inc. (PMI). PMI is the leading international tobacco company, with six of the world’s top 15 international brands, including the number one cigarette brand worldwide Marlboro. PMI’s products are sold in more than 180 markets. However, PMI is far more than a cigarette company. The company wants to change society and deliver a better, smoke-free future. To make its vision a reality it is transforming and staking its entire future on a line of smoke-free products."
Senior Paid Search Associate,dentsu international,"Cairo, Cairo, Egypt",Full-time · Entry level,null,10 applicants,"About the job
Job Title

Senior Paid Search Associate

Job Description

We’re looking for someone passionate about Paid Search to join our growing team and continue to push the boundaries on what’s possible with the Google Ads, Microsoft Ads and Apple Search Ads and other search platforms! Our team works across a varied portfolio of clients of all shapes, industries and sizes, and we work very closely with the major search engines to remain at the cutting edge of our field. We’re looking for people who are geeks (and proud) who want to be positive disruptors in our industry.

This role is suited to someone with 1.5+ years of hands-on Paid Search experience, who can help to develop and drive the tactical initiatives designed to successfully achieve our clients' Paid Search goals. The role is diverse and requires the ability to multi-task, effectively communicate, and continuously self-educate in this dynamic digital marketing space. This requires an understanding of general marketing principles as well as business acumen to support understanding of our clients and the digital marketing space. You will also contribute to the growth of the search department through development of best practice, supporting in new business, and joining cross-department initiatives.





Whether it’s the joy of working with people at the top of their game or the Merkle social calendar, people love working here – and we hope you will too



At Merkle, we believe that a diverse and inclusive environment improves us as a community and as a business. We want to foster an environment of growth, where ideas and contributions are actively encouraged. We need this culture of courage to continue to thrive in our fast-paced industry.

We have created six Diversity and Inclusion Pillars. Each pillar is made up of a community of members who serve as role models and spread a message of inclusion throughout our global workplace. Pillar members are responsible for planning initiatives, events and training, along with championing change within our business. These pillars are Gender, Ethnicity, Mental Health, Religion, Disability, LGBT+.

Merkle is a place that embraces differences of opinion. To be an advocate for real change we really encourage applications from women, candidates with disabilities and Black, Asian and Minority Ethnic (BAME) candidates as we recognise that these groups are currently underrepresented in our marketing/technology industry.





Merkle is a leading data-driven, technology-enabled, global performance marketing agency that specialises in the delivery of unique, personalised customer experiences across platforms and devices. We call it ‘people-based’ marketing, and with over 25 years’ experience, we are proud to be recognised as a global leader.

Merkle’s heritage in data, technology and analytics is the foundation for our understanding of consumer insights that drives our people-based marketing strategies. Combined with our expertise in performance creative and media, we can then offer our clients content-driven, contextual and compelling customer experiences that drive business growth.

In 2016, the agency joined the Dentsu, one of the world’s biggest media companies to form the Customer Experience Management (CXM) Line of Business.



Cairo



Dentsu



Full time



Permanent"
Learning Analyst Associate Manager,Majid Al Futtaim,"Cairo, Egypt",Full-time,null,173 applicants,"About the job
Role Purpose:
Majid Al Futtaim is building a state-of-the-art group-wide Learning and Development function to support the growth of our MAFers and the growth of our businesses."
Customer Service/Technical Support-Spanish,Concentrix,"Cairo, Cairo, Egypt",Full-time · Entry level,null,52 applicants,"About the job
As a Customer Service Advisor within our friendly and supportive team, you will be responsible for:
handling incoming inquiries from Spanish customers via the phone, email and on online,
providing support for customers to effectively resolve their queries,





We know that customer service isn’t for everyone. To be considered for this role, we’ll need you to have the following:

This is a great opportunity for someone looking to join a vibrant, growing, global business where you will have the opportunity to take advantage of excellent learning, development and career opportunities as well as become part of a highly professional and fantastic team.

Do not miss this great job opportunity! Apply now:

40 hours/week on a rotational shift pattern.



With 250,000 colleagues all over the worldwe specialize in creating exceptional customer experiences and driving digital transformation for some of the world’s biggest and best companies.

We’re extremely passionate about the power of exceptional customer experiences, because we know, when someone has an amazing customer experience, it can be life changing!

We’re fanatical about our diverse and passionate people all across the world people. We see and love each of their individualities, because recognize that all our differences make us stronger together. That’s why we show them how important they are by showering them with perks, like a culture of belonging; clear paths for career development; professional support, coaching and mentorship programs; performance-based pay; a global network of lifelong friends and peers; and more! (Like, lots more.) Be true. Be you. Be with us... and together we will make new memories!



The above statements are intended to describe the general nature and level of work being performed by people assigned to this job. They are not intended to be an exhaustive list of all responsibilities, duties, and skills required of personnel working within this job title.

Concentrix is an equal opportunity employer. Concentrix evaluates qualified applicants without regard to race, color, religion, gender, national origin, age, sexual orientation, gender identity or expression, protected veteran status, disability status or any other legally protected characteristic."
Senior Go Developer,Toptal,"Alexandria, Alexandria, Egypt",Contract · Mid-Senior level,null,1 applicant,"About the job
About The Job

Toptal developers work with speed and efficiency to deliver the highest quality of work. We are looking for someone who is passionate about their client’s business, and ready to work on exciting projects with Fortune 500 companies and Silicon Valley startups, with great rates and zero hassles. If you are looking for a place to advance your career, enhance your skill set, and build connections around the globe, Toptal is right for you.



Toptal is an exclusive network of top freelancers from around the world. Fortune 500 companies and Silicon Valley startups hire Toptal for their most important projects. Toptal is one of the fastest-growing fully remote networks and empowers freelance software developers, designers, finance experts, product managers, and project managers worldwide to grow and excel in their freelance careers.

Toptal clients vary in sizes and industries, from enterprise organizations and big tech companies to Silicon Valley startups and renowned universities. Once you enter the network, our matchers will contact you with project opportunities that fit your expertise and preferences. We have experts in over 120 countries who get to work remotely on projects that meet their career ambitions.



We are looking for a great Go developer who has a strong understanding of how best to leverage and exploit the language’s unique paradigms, idioms, and syntax. Your primary focus will be on developing Go packages and programs that are scalable and maintainable. You will ensure that these Go packages and programs are well documented and have reasonable test coverage. A commitment to collaborative problem solving, sophisticated design, and quality product is essential.



If you’re interested in pursuing an engaging career working on full-time freelance jobs for exclusive clients, take the next step by clicking apply and filling out the short form to get started.

#RemoteJobGo"
"ETIC, Quality Assurance & Process Improvement Lead (Egypt)",PwC Middle East,"Cairo, Cairo, Egypt",Full-time · Mid-Senior level,null,88 applicants,"About the job
Line of Service

Advisory

Industry/Sector

Technology



Advisory - Other



Senior Manager



A career within Egypt Technology and Innovation Center, will provide you with the opportunity to help our clients design customer strategies that address the customers’ underlying needs and desired outcomes. We help build bridges between digital and analog mediums, delivering personal and contextual experiences powered by technology and analytics, and driving the total experience by engaging the customer, product, partner, and employee experiences.

As a Senior Manager, you'll work as part of a team of problem solvers, helping to solve complex business issues from strategy to execution.










Degrees/Field of Study preferred:











Not Specified



Yes



No"
Customer Service/Technical Support-French,Concentrix,"Cairo, Cairo, Egypt",Full-time · Entry level,null,54 applicants,"About the job
As a Customer Service Advisor within our friendly and supportive team, you will be responsible for:
handling incoming inquiries from French speaking customers via the phone, email and on online,
providing support for customers to effectively resolve their queries,





We know that customer service isn’t for everyone. To be considered for this role, we’ll need you to have the following:

This is a great opportunity for someone looking to join a vibrant, growing, global business where you will have the opportunity to take advantage of excellent learning, development and career opportunities as well as become part of a highly professional and fantastic team.

Do not miss this great job opportunity! Apply now:

40 hours/week on a rotational shift pattern.



With 250,000 colleagues all over the worldwe specialize in creating exceptional customer experiences and driving digital transformation for some of the world’s biggest and best companies.

We’re extremely passionate about the power of exceptional customer experiences, because we know, when someone has an amazing customer experience, it can be life changing!

We’re fanatical about our diverse and passionate people all across the world people. We see and love each of their individualities, because recognize that all our differences make us stronger together. That’s why we show them how important they are by showering them with perks, like a culture of belonging; clear paths for career development; professional support, coaching and mentorship programs; performance-based pay; a global network of lifelong friends and peers; and more! (Like, lots more.) Be true. Be you. Be with us... and together we will make new memories!



The above statements are intended to describe the general nature and level of work being performed by people assigned to this job. They are not intended to be an exhaustive list of all responsibilities, duties, and skills required of personnel working within this job title.

Concentrix is an equal opportunity employer. Concentrix evaluates qualified applicants without regard to race, color, religion, gender, national origin, age, sexual orientation, gender identity or expression, protected veteran status, disability status or any other legally protected characteristic."
Performance Analyst Lead,Cartona,"Ad-Duqqi, Al Jizah, Egypt",Full-time · Associate,null,24 applicants,"About the job
What You Will Do..
Responsible for optimizing our performance reporting structure and repeatable process
Performance Reporting and Analysis
Optimize our KPI dashboard









Once you apply, you start your journey of CV screening, Phone Screening, Technical interview, HR interview and Final interview.



LinkedIn : https://www.linkedin.com/company/cartona-egypt/mycompany/?viewAsMember=true

Facebook: https://www.facebook.com/CartonaCareers/`"
Senior Group Sales Agent- Cairo,Qatar Airways,"Cairo, Cairo, Egypt",Full-time · Associate,null,Over 200 applicants,"About the job
Qatar Airways (QR) have embarked on an exciting transformation journey to change how we interact with our customers. As part of this journey, we are now recruiting for the role of Senior Group Sales Agent.

In this role, you assist station with handling and negotiating QR groups and seats allocation in respect of company processes and sales strategy. You will generate groups’ revenue through sales actions and assist customers for all issues related to groups, allocation and negotiated space reservations. You will develop and increase sales contracts and prospects. You will participate the achievement of revenue budget and maintain QR quality services.





Your skills. Your imagination. Your ambition. Here, there are no boundaries to your potential and the impact you can make. You’ll find infinite opportunities to grow and work on the biggest, most rewarding challenges that will build your skills and experience. You have the chance to be a part of our future, and build the life you want while being part of an international community.

Our best is here and still to come. To us, impossible is only a challenge. Join us as we dare to achieve what’s never been done before.

Together, everything is possible





So whether you’re creating a unique experience for our customers or innovating behind the scenes, every person contributes to our proud story. A story of spectacular growth and determination. Now is the time to bring your best ideas and passion to a place where your ambition will know no boundaries, and be part of a truly global community."
"Assistant Manager, Internal Audit",noon,"Cairo, Egypt",Full-time · Mid-Senior level,null,Over 200 applicants,"About the job
Assistant Manager - Internal Audit
Reporting to: Regional Lead- Internal Audit

About noon
noon.com is a technology leader with a simple mission: to be the best place to buy and sell things. In doing this we hope to accelerate the digital economy of the Middle East, empowering regional talent and businesses to meet the full range of consumers' online needs."
Wellness Coach,Sutherland,"Cairo, Egypt",Full-time · Director,null,147 applicants,"About the job
The Role
The primary role of the Wellness Coach is to promote a culture of wellbeing by developing and deploying a Wellness Program that embeds wellbeing into everyday life and improves the overall employee experience. Through the program, you will create awareness of wellbeing and the signs of ill health, investigate preventative measures and ensure people know what support is available. The primary stakeholders are people managers, to help them understand their role supporting their team, and individuals to encourage personal ownership and help employees achieve holistic wellbeing."
"ETIC, Salesforce Marketing Cloud Consultant - Manager (Egypt)",PwC Middle East,"Cairo, Cairo, Egypt",Full-time · Mid-Senior level,null,22 applicants,"About the job
Line of Service

Advisory

Industry/Sector

Technology



Advisory - Other



Manager





PwC is opening a new Technology & Innovation Center in Cairo that will deliver high quality technology solutions to consulting Clients across the globe. The Centre will provide a broad suite of skills and services to our clients, ranging from Packaged Applications such as SAP & Oracle, to Cloud services utilising AWS, Azure and Google, as well as expanding our existing Managed Services capabilities.

The center is looking to expand rapidly and we are looking for enthusiastic self-starters with a passion for technology and client delivery to help shape and form this new venture.

We are seeking to recruit a Salesforce Marketing Cloud Consultant to join our team in Cairo. The successful candidate will have a minimum of 6 years experience in delivering complex Salesforce solutions. They will be building a growing reputation within the local Salesforce market, and will bring a developing professional network, and good alliances into the Salesforce ecosystem.

You will report to the Salesforce delivery service leadership team and will be an integral part of the team based in Cairo, as well as those delivering client transformation programmes across the PwC Global Network, including the UK, Germany and Middle East.












Degrees/Field of Study preferred:











Not Specified



Yes



No"
Talent Acquisition Coordinator - Egypt,General Motors,"Giza, Al Jizah, Egypt",Full-time,null,Over 200 applicants,"About the job
Job Description

As a member of GM's Talent Acquisition Group you will be a brand ambassador who supports the Global Talent Acquisition's vision and leads the recruiting process using technology, analytics, collaboration, white-gloved customer service skills for Egypt.

You will support and collaborate with respective internal groups and employees focusing on new ideas, solutions, team calls, mentoring, partnerships with colleagues, hiring managers and HR.





University Graduated.

Strong experience in talent acquisition role.

Fluent in English.

Competencies: Problem Solving, Authonomy, Empathy, Communication skills and Energy.



Our vision is a world with Zero Crashes, Zero Emissions and Zero Congestion and we embrace the responsibility to lead the change that will make our world better, safer and more equitable for all.



We aspire to be the most inclusive company in the world. We believe we all must make a choice every day - individually and collectively - to drive meaningful change through our words, our deeds and our culture. Our Work Appropriately philosophy supports our foundation of inclusion and provides employees the flexibility to work where they can have the greatest impact on achieving our goals, dependent on role needs. Every day, we want every employee, no matter their background, ethnicity, preferences, or location, to feel they belong to one General Motors team.



General Motors is committed to being a workplace that is not only free of discrimination, but one that genuinely fosters inclusion and belonging. We strongly believe that workforce diversity creates an environment in which our employees can thrive and develop better products for our customers. We understand and embrace the variety through which people gain experiences whether through professional, personal, educational, or volunteeropportunities.

We encourage interested candidates to review the key responsibilities and qualifications and apply for any positions that match your skills and capabilities."
Internal Communications Manager – MEA,Mars,"Cairo, Egypt",Full-time · Associate,null,Over 200 applicants,"About the job
Job Purpose:

Align and engage Mars Wrigley MEA Associates through strategic communications while enhancing the reputation of Mars. Be a consultant, create and execute the strategy and plans for effective communication from the Management Team and Functional Leads to the Associates, particularly to promote business alignment, change management and the Essence of Mars. Provide communications support to develop external corporate reputation and community engagement programs"
Head of Global Liquidity and Cash Management Product - Commercial Banking,HSBC,"Ḩulwān, Cairo, Egypt",Full-time,null,30 applicants,"About the job
Job Description

Role Purpose:

The purpose of this role is to manage and develop HSBC products with the objective of contributing to profitability and to enhance the client experience. The role will lead a team of product specialists within country as well as supporting the regional product strategy. Principle responsibilities will include;"
"Consultancy: Pipeline Manager, CFYE Egypt",Challenge Fund for Youth Employment,"Cairo, Egypt",Part-time · Mid-Senior level,null,89 applicants,"About the job
About the Programme:
The Challenge Fund for Youth Employment (CFYE) is a 6-year and €114 million programme funded by the Netherlands Ministry of Foreign Affairs, that aims to create a prosperous future for 200,000 young women and men in the Middle East, North Africa, Sahel & West Africa and Horn of Africa regions. The Fund will be supporting initiatives in 23 countries that will offer youth, in particular young women, opportunities for work that is demand-driven and productive, offering a stable income and safe working conditions, and that is contributing to their personal development and social protection."
